[
  {
    "id": "agua-09h",
    "title": "\uD83D\uDCA7 \u00C1gua",
    "message": "Voc\u00EA tomou \u00E1gua?",
    "hour": 9,
    "minute": 0,
    "active": true
  },
  {
    "id": "agua-10h",
    "title": "\uD83D\uDCA7 \u00C1gua",
    "message": "Voc\u00EA tomou \u00E1gua?",
    "hour": 10,
    "minute": 0,
    "active": true
  },
  {
    "id": "agua-11h",
    "title": "\uD83D\uDCA7 \u00C1gua",
    "message": "Voc\u00EA tomou \u00E1gua?",
    "hour": 11,
    "minute": 0,
    "active": true
  },
  {
    "id": "agua-12h",
    "title": "\uD83D\uDCA7 \u00C1gua",
    "message": "Voc\u00EA tomou \u00E1gua?",
    "hour": 12,
    "minute": 0,
    "active": true
  },
  {
    "id": "agua-13h",
    "title": "\uD83D\uDCA7 \u00C1gua",
    "message": "Voc\u00EA tomou \u00E1gua?",
    "hour": 13,
    "minute": 0,
    "active": true
  },
  {
    "id": "agua-14h",
    "title": "\uD83D\uDCA7 \u00C1gua",
    "message": "Voc\u00EA tomou \u00E1gua?",
    "hour": 14,
    "minute": 0,
    "active": true
  },
  {
    "id": "agua-15h",
    "title": "\uD83D\uDCA7 \u00C1gua",
    "message": "Voc\u00EA tomou \u00E1gua?",
    "hour": 15,
    "minute": 0,
    "active": true
  },
  {
    "id": "agua-16h",
    "title": "\uD83D\uDCA7 \u00C1gua",
    "message": "Voc\u00EA tomou \u00E1gua?",
    "hour": 16,
    "minute": 0,
    "active": true
  },
  {
    "id": "agua-17h",
    "title": "\uD83D\uDCA7 \u00C1gua",
    "message": "Voc\u00EA tomou \u00E1gua?",
    "hour": 17,
    "minute": 0,
    "active": true
  },
  {
    "id": "agua-18h",
    "title": "\uD83D\uDCA7 \u00C1gua",
    "message": "Voc\u00EA tomou \u00E1gua?",
    "hour": 18,
    "minute": 0,
    "active": true
  },
  {
    "id": "agua-19h",
    "title": "\uD83D\uDCA7 \u00C1gua",
    "message": "Voc\u00EA tomou \u00E1gua?",
    "hour": 19,
    "minute": 0,
    "active": true
  },
  {
    "id": "agua-20h",
    "title": "\uD83D\uDCA7 \u00C1gua",
    "message": "Voc\u00EA tomou \u00E1gua?",
    "hour": 20,
    "minute": 0,
    "active": true
  }
]
